{
  "spec": "fleet.page/1",
  "id": "settings.work",
  "title": "Work graph",
  "parent": "settings",
  "layout": "category",
  "intro": "How sessions are linked to tickets, tidied up and remembered.",
  "tabs": [
    {
      "title": "Detection",
      "sections": [
        {
          "title": "Trackers",
          "items": [
            {
              "type": "field",
              "key": "work.sync_interval_secs"
            },
            {
              "type": "field",
              "key": "work.recent_days"
            },
            {
              "type": "field",
              "key": "work.describe_cache_secs"
            }
          ]
        },
        {
          "title": "Linking",
          "items": [
            {
              "type": "field",
              "key": "work.evidence_snippets"
            },
            {
              "type": "field",
              "key": "work.session_start_context"
            },
            {
              "type": "field",
              "key": "work.classify_nudge"
            },
            {
              "type": "field",
              "key": "work.members_plan_sprints"
            },
            {
              "type": "field",
              "key": "work.trusted_branch_projects",
              "hint": "Set from the work popover; clear it here."
            }
          ]
        },
        {
          "title": "Writing help",
          "items": [
            {
              "type": "field",
              "key": "work.summary_model"
            },
            {
              "type": "field",
              "key": "work.context_help"
            },
            {
              "type": "field",
              "key": "work.help_model"
            },
            {
              "type": "field",
              "key": "work.draft_commit_messages"
            },
            {
              "type": "field",
              "key": "work.draft_briefs"
            },
            {
              "type": "field",
              "key": "work.draft_task_titles"
            },
            {
              "type": "field",
              "key": "work.draft_release_notes"
            },
            {
              "type": "field",
              "key": "work.catch_up_summaries"
            }
          ]
        }
      ]
    },
    {
      "title": "Tidy-up",
      "sections": [
        {
          "title": "When to suggest",
          "items": [
            {
              "type": "field",
              "key": "work.tidy_done_days"
            },
            {
              "type": "field",
              "key": "work.tidy_idle_hours"
            },
            {
              "type": "field",
              "key": "work.tidy_idle_unlinked_days"
            }
          ]
        },
        {
          "title": "Auto-tidy",
          "items": [
            {
              "type": "field",
              "key": "work.auto_tidy"
            },
            {
              "type": "field",
              "key": "work.auto_tidy_reasons",
              "when": {
                "key": "work.auto_tidy",
                "truthy": true
              }
            },
            {
              "type": "notice",
              "tone": "warn",
              "text": "On, the sweep safe-kills finished sessions without asking. A session that is working, waiting on you, linked to in-progress work or used in the last hour is never touched."
            },
            {
              "type": "custom",
              "component": "auto_tidy_preview"
            }
          ]
        }
      ]
    },
    {
      "title": "Retention",
      "sections": [
        {
          "title": "How long work history is kept",
          "items": [
            {
              "type": "field",
              "key": "work.retention.journal_days"
            },
            {
              "type": "field",
              "key": "work.retention.tracker_items_days"
            },
            {
              "type": "field",
              "key": "work.retention.timeline_work_events_days"
            },
            {
              "type": "table",
              "source": {
                "id": "work.retention"
              }
            },
            {
              "type": "record",
              "source": {
                "id": "work.retention_last"
              }
            },
            {
              "type": "action",
              "action": "work.retention_sweep"
            }
          ]
        },
        {
          "title": "Attachments",
          "items": [
            {
              "type": "field",
              "key": "work.attachment_max_mb"
            }
          ]
        }
      ]
    },
    {
      "title": "Missions",
      "sections": [
        {
          "title": "Mission loop",
          "items": [
            {
              "type": "field",
              "key": "orchestrator.enabled"
            },
            {
              "type": "field",
              "key": "orchestrator.max_level",
              "when": {
                "key": "orchestrator.enabled",
                "truthy": true
              }
            },
            {
              "type": "field",
              "key": "orchestrator.headless_checks",
              "when": {
                "key": "orchestrator.enabled",
                "truthy": true
              }
            },
            {
              "type": "field",
              "key": "orchestrator.headless_model",
              "when": {
                "key": "orchestrator.headless_checks",
                "truthy": true
              }
            }
          ]
        }
      ]
    }
  ]
}
