{
  "spec": "fleet.page/1",
  "id": "settings.control_api",
  "title": "Control API",
  "parent": "settings",
  "layout": "category",
  "intro": "The embedded MCP server an AI assistant drives the fleet through (read-only here), how Control's chat goes on when you do not answer, and what Control's agent hears about the fleet.",
  "sections": [
    {
      "title": "Server",
      "items": [
        {
          "type": "field",
          "key": "mcp.enabled"
        },
        {
          "type": "field",
          "key": "mcp.port"
        },
        {
          "type": "field",
          "key": "mcp.confirm_destructive"
        },
        {
          "type": "field",
          "key": "mcp.broadcast_interval_secs"
        }
      ]
    },
    {
      "title": "Chat",
      "items": [
        {
          "type": "field",
          "key": "control.auto_continue"
        },
        {
          "type": "field",
          "key": "control.auto_continue_minutes"
        }
      ]
    },
    {
      "title": "Fleet events",
      "items": [
        {
          "type": "field",
          "key": "control.react_to_events"
        },
        {
          "type": "field",
          "key": "control.feed_min_interval_secs",
          "when": {
            "key": "control.react_to_events",
            "truthy": true
          }
        },
        {
          "type": "field",
          "key": "control.switch_at_limit"
        },
        {
          "type": "field",
          "key": "control.sweep",
          "when": {
            "key": "control.react_to_events",
            "truthy": true
          }
        },
        {
          "type": "field",
          "key": "control.follow_quiet_hours",
          "when": {
            "key": "control.react_to_events",
            "truthy": true
          }
        },
        {
          "type": "field",
          "key": "control.journal"
        }
      ]
    }
  ]
}
