{
  "spec": "fleet.page/1",
  "id": "settings.federation",
  "title": "Federation",
  "parent": "settings",
  "layout": "master_detail",
  "resource": "peer_link",
  "intro": "Other fleets' hubs this hub is linked to. Sessions on both sides can message each other through the link. Linking and unlinking need this device to be trusted.",
  "sections": [
    {
      "title": "Link",
      "items": [
        { "type": "field", "key": "title" },
        { "type": "field", "key": "state" },
        { "type": "field", "key": "role" },
        { "type": "field", "key": "url" },
        { "type": "field", "key": "last_error" }
      ]
    },
    {
      "title": "Traffic",
      "items": [
        { "type": "field", "key": "latency" },
        { "type": "field", "key": "messages_today" },
        { "type": "field", "key": "messages_total" },
        { "type": "field", "key": "pending" },
        { "type": "field", "key": "last_exchange_at" }
      ]
    }
  ]
}
